{
  "template_metadata": {
    "template_type": "comparative_dashboard",
    "template_version": "1.0.0",
    "created_at": "2025-10-21T06:00:00Z",
    "exported_at": "2025-10-21T06:30:00Z"
  },
  "comparison_metadata": {
    "evaluator": "Test Evaluator",
    "num_systems": 3,
    "comparison_date": "2025-10-21",
    "comparison_purpose": "Test data for Phase 4 automated utility"
  },
  "systems_compared": [
    {
      "system_name": "DDSP",
      "system_version": "v3.2.1",
      "synthesis_file": "synthesis_ddsp.json",
      "sessions_imported": 2,
      "journal_entries": 3,
      "evaluation_date": "2025-10-15"
    },
    {
      "system_name": "MusicGen",
      "system_version": "v1.2",
      "synthesis_file": "synthesis_musicgen.json",
      "sessions_imported": 2,
      "journal_entries": 4,
      "evaluation_date": "2025-10-16"
    },
    {
      "system_name": "Riffusion",
      "system_version": "1.5.3",
      "synthesis_file": "synthesis_riffusion.json",
      "sessions_imported": 2,
      "journal_entries": 3,
      "evaluation_date": "2025-10-17"
    }
  ],
  "score_matrix": {
    "criteria_scores": {
      "usability": [3.0, 4.5, 4.0],
      "generation_speed": [5.0, 3.5, 2.0],
      "audio_quality": [5.0, 4.5, 3.5],
      "stylistic_accuracy": [3.0, 4.0, 3.5],
      "parameter_control": [2.5, 4.0, 3.0],
      "content_generation_control": [2.0, 4.5, 3.0],
      "daw_integration": [3.5, 2.0, 4.0],
      "creative_workflow_fit": [3.0, 4.0, 3.5]
    },
    "average_scores": [3.38, 3.88, 3.31],
    "statistics": {
      "means": {
        "usability": 3.83,
        "generation_speed": 3.50,
        "audio_quality": 4.33,
        "stylistic_accuracy": 3.50,
        "parameter_control": 3.17,
        "content_generation_control": 3.17,
        "daw_integration": 3.17,
        "creative_workflow_fit": 3.50
      },
      "std_devs": {
        "usability": 0.76,
        "generation_speed": 1.50,
        "audio_quality": 0.76,
        "stylistic_accuracy": 0.50,
        "parameter_control": 0.76,
        "content_generation_control": 1.26,
        "daw_integration": 1.00,
        "creative_workflow_fit": 0.50
      },
      "ranges": {
        "usability": 1.5,
        "generation_speed": 3.0,
        "audio_quality": 1.5,
        "stylistic_accuracy": 1.0,
        "parameter_control": 1.5,
        "content_generation_control": 2.5,
        "daw_integration": 2.0,
        "creative_workflow_fit": 1.0
      },
      "winners": {
        "usability": ["MusicGen"],
        "generation_speed": ["DDSP"],
        "audio_quality": ["DDSP"],
        "stylistic_accuracy": ["MusicGen"],
        "parameter_control": ["MusicGen"],
        "content_generation_control": ["MusicGen"],
        "daw_integration": ["Riffusion"],
        "creative_workflow_fit": ["MusicGen"]
      }
    }
  },
  "criterion_comparisons": [
    {
      "criterion_name": "Usability",
      "winner": "MusicGen",
      "performance_comparison": "MusicGen leads with 4.5/5, followed by Riffusion (4.0) and DDSP (3.0)",
      "root_cause_analysis": "MusicGen's web interface is most intuitive",
      "practical_implications": "Beginners will find MusicGen easiest to learn"
    }
  ],
  "patterns": {
    "universal_strengths": ["Good audio quality overall"],
    "universal_limitations": ["Limited DAW integration"],
    "field_level_insights": "AI music generation tools are maturing rapidly",
    "distinctive_capabilities": [
      {
        "system": "DDSP",
        "unique_strengths": ["Fastest generation", "Best audio quality"]
      },
      {
        "system": "MusicGen",
        "unique_strengths": ["Most user-friendly", "Best control"]
      },
      {
        "system": "Riffusion",
        "unique_strengths": ["Best DAW integration"]
      }
    ]
  },
  "use_case_recommendations": {
    "task_mappings": [
      {
        "task": "Quick Ideation",
        "recommended_system": "DDSP",
        "rationale": "Fastest generation speed"
      }
    ],
    "user_profiles": {
      "beginners": {
        "recommended_system": "MusicGen",
        "rationale": "Most user-friendly interface"
      },
      "professionals": {
        "recommended_system": "MusicGen",
        "rationale": "Best overall control and quality"
      },
      "experimental_artists": {
        "recommended_system": "DDSP",
        "rationale": "Unique audio-to-audio workflow"
      }
    }
  },
  "evaluator_synthesis": {
    "surprises": "DDSP's speed was remarkable",
    "confirmations": "MusicGen lives up to usability expectations",
    "open_questions": "How will these systems evolve?",
    "evaluator_positionality": "Electronic music producer with 10 years experience",
    "final_recommendation": {
      "single_choice": "MusicGen",
      "rationale": "Best balance of usability, control, and quality"
    }
  },
  "visualizations": {
    "radar_chart_generated": true,
    "heatmap_generated": true,
    "bar_chart_generated": true
  }
}
